### ISSUE TITLE
dnseval -m: Queries also the OS suffix?

### ISSUE THREAD

**Issue by webernetz** [farrokhi/dnsdiag#47]
Hi Babak,

I am currently testing the -m version but I got no results within dnseval.

At girst I can see with tcpdump that after every request another request with the OS suffix is issued. Do you have an idea why?
I used this command:
`./dnseval.py -f ../dns-server2 -m heise.de
`
And the first requests ask for this, while "weberlab.de" is my first DNS search on my Linux machine:
`_dnsdiag_Ya8cr6GBof_.heise.de.`
`_dnsdiag_Ya8cr6GBof_.heise.de.weberlab.de.`

<pre><code>14:19:40.785757 IP 192.168.110.8.47259 > google-public-dns-a.google.com.domain: 44401+ [1au] A? _dnsdiag_Ya8cr6GBof_.heise.de. (58)
14:19:40.815405 IP google-public-dns-a.google.com.domain > 192.168.110.8.47259: 44401 NXDomain 0/1/1 (108)
14:19:40.817865 IP 192.168.110.8.34726 > google-public-dns-a.google.com.domain: 39729+ [1au] A? _dnsdiag_Ya8cr6GBof_.heise.de.weberlab.de. (70)
14:19:42.788582 IP 192.168.110.8.50938 > google-public-dns-a.google.com.domain: 41611+ [1au] A? _dnsdiag_3H3yb8kj8_.heise.de. (57)
14:19:42.832729 IP google-public-dns-a.google.com.domain > 192.168.110.8.50938: 41611 NXDomain 0/1/1 (107)
14:19:42.835799 IP 192.168.110.8.58572 > google-public-dns-a.google.com.domain: 46528+ [1au] A? _dnsdiag_3H3yb8kj8_.heise.de.weberlab.de. (69)
14:19:44.791347 IP 192.168.110.8.46851 > google-public-dns-a.google.com.domain: 11960+ [1au] A? _dnsdiag_4VRfNq9_.heise.de. (55)
14:19:44.833386 IP google-public-dns-a.google.com.domain > 192.168.110.8.46851: 11960 NXDomain 0/1/1 (105)
14:19:44.835892 IP 192.168.110.8.43862 > google-public-dns-a.google.com.domain: 53913+ [1au] A? _dnsdiag_4VRfNq9_.heise.de.weberlab.de. (67)</code></pre>

**Comment by farrokhi** [comment]
Hi Johannes,

Could you please confirm if you have the latest commit? There have been a few minor changes in the last moments. I am currently seeing the following output:
```
% ./dnseval.py -m -f public-v4.txt heise.de
server             avg(ms)     min(ms)     max(ms)     stddev(ms)  lost(%)  ttl        flags
-----------------------------------------------------------------------------------------------------------
8.8.8.8            493.979     360.935     616.074     80.610      %0       N/A        -- -- -- -- -- -- --
8.8.4.4            497.772     386.088     615.285     75.364      %0       N/A        -- -- -- -- -- -- --
9.9.9.9            559.624     331.593     1005.381    223.595     %30      N/A        -- -- -- -- -- -- --
4.2.2.1            604.202     407.733     920.090     176.879     %0       N/A        -- -- -- -- -- -- --
4.2.2.2            583.657     390.832     863.693     143.861     %0       N/A        -- -- -- -- -- -- --
4.2.2.3            770.853     458.582     1331.859    317.023     %30      N/A        -- -- -- -- -- -- --
209.244.0.3        825.137     410.037     1641.012    362.986     %0       N/A        -- -- -- -- -- -- --
195.46.39.39       440.093     319.986     613.777     108.508     %0       N/A        -- -- -- -- -- -- --
216.146.35.35      753.104     658.012     843.818     62.806      %20      N/A        -- -- -- -- -- -- --
208.67.222.222     436.815     273.048     614.485     95.723      %0       N/A        -- -- -- -- -- -- --
```

**Comment by farrokhi** [comment]
As for the search suffix that you see in your tcpdump output, I believe this is triggered by the your local stub resolver since you have set the "search domain". I am not sure how we can override this behavior and how significant it might be in our tests.

**Comment by webernetz** [comment]
> Could you please confirm if you have the latest commit?

How exactly can I do that? I just cloned the project completely again (git clone https://github.com/farrokhi/dnsdiag.git) but it's still not working.

**Comment by farrokhi** [comment]
That's it. If you cloned the main repo then you are good to go.
I installed a new Fedora 27 VM and cloned dnsdiag from git, but could not reproduce what you are seeing. Here is the output:
```(.venv) [farrokhi@bluehat dnsdiag]$ ./dnseval.py -m -f public-v4.txt yahoo.com
server             avg(ms)     min(ms)     max(ms)     stddev(ms)  lost(%)  ttl        flags
-----------------------------------------------------------------------------------------------------------
8.8.8.8            648.491     538.552     772.578     77.655      %0       N/A        -- -- -- -- -- -- --
8.8.4.4            621.279     476.521     916.522     167.026     %0       N/A        -- -- -- -- -- -- --
9.9.9.9            255.776     182.823     453.712     98.024      %0       N/A        -- -- -- -- -- -- --
4.2.2.1            769.485     338.642     1513.310    336.534     %0       N/A        -- -- -- -- -- -- --
4.2.2.2            625.549     444.786     1167.955    233.878     %20      N/A        -- -- -- -- -- -- --
209.244.0.3        840.378     212.401     1790.225    503.116     %0       N/A        -- -- -- -- -- -- --
195.46.39.39       273.677     205.118     482.036     85.553      %0       N/A        -- -- -- -- -- -- --
216.146.35.35      300.835     264.854     377.139     37.446      %0       N/A        -- -- -- -- -- -- --
208.67.222.222     641.034     359.380     819.315     152.990     %0       N/A        -- -- -- -- -- -- --
```
Would you mind sharing a bit about your setup so that I can catch this?

**Comment by farrokhi** [comment]
can't reproduce. please reopen if you can provide a test case.

**Comment by webernetz** [comment]
Yup, I can't reproduce it, either. ;)
